"4","Any tips on how to use cover and concealment during a battle?"
"3","What are the targets we are trying to reach with this mission?"
"13","Can we share resources and support each other's goals?"
"10","What should I do if a health potion is expired?"
"7","We need to improve our axe technique, let's practice until we do."
"6","Focus on your sword training!"
"11","Attack with speed and precision!"
"4","Can you suggest some tactics for avoiding getting pinned down in combat?"
"5","What's the best way to complete this quest?"
"10","I need to get some treatment for my dental phobia."
"4","How do you recommend fighting against fake news?"
"3","What are the steps we need to take to accomplish our current mission?"
"5","What kind of problem-solving skills do I need to demonstrate while completing this task?"
"1","Describe the pivotal moments that have shaped your life."
"11","Strike with accuracy and precision!"
"6","Are you ready to take on the challenge of sword training?"
"3","We are on a mission to promote interfaith harmony and understanding."
"10","Quick, heal me!"
"11","The enemy is closing in, it's time to engage in close combat."
"13","Let's do a resource swap."
"11","We need to stay focused and alert when engaging in close combat."
"15","Be alert for any potential sources of light or fire in the area."
"5","What is the scope of the task, and how do I ensure I don't go beyond it?"
"8","I want to train my mace thrusts and hooks."
"15","Take a companion with you for safety."
"9","Shall we start practicing for a fist fight today?"
"15","The nearby place is waiting to be explored."
"12","Prepare for ranged combat."
"14","We need your help to hack this lock."
"9","Can we practice some self-defense techniques using only our fists?"
"5","Are there any side quests that need to be completed before finishing this quest?"
"4","How do I fight against injustice and oppression in my community?"
"7","Get motivated and start your axe training."
"3","What is the desired end result of our current mission?"
"10","Should I prioritize healing over completing objectives with low health?"
"4","Any advice for engaging in hand-to-hand combat during a battle?"
"4","What are some good ways to train for endurance in a fight?"
"8","Are you interested in practicing with the mace to improve your combat skills?"
"10","Heal me like you're my guardian angel."
"3","What are the priorities for our current mission?"
"1","What are your thoughts on accountability? Can you tell me about a time when you took responsibility for a mistake and worked to make things right?"
"13","Sharing resources can lead to more innovation."
"1","Can you describe your problem-solving approach? Tell me about a time when you used a systematic approach to solve a problem."
"15","Cover every inch of the area."
"9","Let's dedicate more time to upskilling our fist fighting."
"8","Let's get better at mace fighting, starting with the basics."
"5","Can I complete this quest solo or do I need a group?"
"8","Can mace training be done at home or do you need special equipment?"
"1","Tell me about a time when you had to step outside of your comfort zone in order to achieve a goal, and how you approached that challenge."
"12","Stay on target and let your ranged attacks do the talking!"
"2","How has our understanding of economics impacted the way we see the world?"
"14","Show me your expertise in lock hacking."
"3","What is the task that we need to complete today?"
"2","What kind of people live in this place?"
"7","Do you want to sharpen your axe skills?"
"9","Would you like to engage in a friendly fist sparring match?"
"15","Look for any natural hiding places as you search the area."
"9","It's time to level up our fist fighting abilities."
"11","Let's engage in close combat."
"10","Can low health lead to death? I have little left."
"11","We need to be ready for hand-to-hand combat."
"9","Let's work on our timing and precision in fist fighting."
"3","What are we trying to accomplish right now?"
"8","Would you like to work on your mace technique together?"
"5","What are the deadlines for completing each stage of this task?"
"10","I have a thyroid problem and need to find the right treatment."
"6","It's time to sharpen our sword skills through training."
"15","It's time to get out and explore the place nearby."
"12","Let your arrow do the talking!"
"4","Can you give me some advice on using explosives in combat?"
"4","Do you have any advice on how to approach battles?"
"15","Conduct a thorough search of the area for any evidence."
"7","Let's sharpen those axe skills and become unstoppable!"
"1","How did you learn to embrace change and uncertainty?"
"13","Let's exchange some gear."
"5","How can I track my progress on this quest?"
"9","I want to challenge myself through fist fight sparring."
"3","Can you jog my memory about our current task?"
"7","Let's begin your axe reflex training."
"2","Can you tell me about the different types of human rights that are recognized in this world?"
"1","What led you to pursue your dreams and turn them into reality?"
"12","Keep your head down and fight in ranged combat."
"15","Keep your equipment in good condition."
"3","How does our current task align with our overall goals?"
"12","Engage in ranged combat!"
"9","Keep your mind focused and clear during training!"
"2","Can you share any interesting facts about this place?"
"9","Would you like to improve your overall strength and conditioning with some fist fighting?"
"1","Share your path to finding your purpose."
"8","Do you think mace training can improve our combat abilities?"
"8","Can using the mace help with back pain or posture issues?"
"6","Don't just swing your sword, train with purpose."
"15","Keep an eye out for any signs of life in the area."
"8","Grab your mace and let's start the workout."
"5","What if I don't understand how to complete this task?"
"14","Use your skills to hack the lock and impress us."
"6","Are you interested in learning the ways of the sword with me?"
"13","I'm looking to trade some things."
"10","Does my breathing sound abnormal to you?"
"11","In close combat, there is no room for error."
"15","Walk down the path and see where it takes us."
"6","Ready your sword and start your training session."
"4","How do I use psychological warfare in my battle tactics?"
"14","Can you pick a combination lock?"
"2","The world is both ancient and new."
"8","Have you ever tried mace training for improving your grip strength?"
"5","Can you suggest any collaborative strategies to complete this task?"
"10","My body is breaking out in hives"
"6","Let's dedicate some time to training with our swords."
"1","What are your thoughts on continuous feedback? Can you tell me about a time when you received feedback and used it to improve your work?"
"6","Develop your sword technique!"
"9","Do you think we should practice in different environments for fist fighting readiness?"
"6","Ready to become a sword master? Let's start training!"
"2","The world is full of both love and hate."
"11","We need to take the fight to the next level - up close and personal."
"7","Begin your axe teamwork training."
"7","Train with me and become an axe-wielding powerhouse!"
"5","Can I get an extension to complete this task?"
"4","Should I focus on grappling or striking in my fighting style?"
"6","Sharpen your sword and your mind with training."
"13","Let's swap equipment and get better gear."
"7","Let's have a friendly axe duel to see who's the most skilled."
"5","Can you recommend any tools or processes for measuring my progress while completing this task?"
"5","What are the critical success factors for completing this task?"
"13","What kind of resources do you have in your inventory?"
"2","What's unique about this place?"
"5","What steps do I need to take to finish this quest?"
"1","Can you describe your approach to product development? Tell me about a time when you were involved in the development of a successful product."
"11","Close combat is where we can show our true skill."
"11","Let's go in and end this with some close combat."
"3","I demand that you remind me the essence of our current mission immediately."
"4","What's the best way to approach a battle against multiple opponents?"
"2","This world is full of both forgiveness and vengeance."
"1","What led you to make the sacrifices necessary to achieve your goals?"
"10","I have a pounding headache"
"2","Can you tell me about the different types of plants that exist in this world?"
"9","Be the best in the ring with fist fight training!"
"4","What's the best way to train for a boxing match?"
"11","It's time to get up close and dirty."
"8","Have you noticed any improvements in your lower body strength since starting mace training?"
"9","Would you like to work on your striking abilities with me?"
"7","Let's practice our axe moves and tricks to become more versatile."
"11","Use your opponent's body weight against them and strike!"
"8","How comfortable are you with using a mace in combat situations?"
"6","Do you want to become a master of the sword with me?"
"8","Let's take our mace training up a notch."
"13","Would you like to trade resources?"
"10","I need to get some treatment for my arthritis."
"14","We need your help to hack this lock and open the door."
"7","Have you ever considered training with an axe?"
"6","Shall we practice some sword combat together?"
"11","Close combat is our best chance."
"3","What is the task that's on the top of our list?"
"6","Take your sword and start practicing."
"15","Keep an eye out for any edible plants or berries."
"15","Be on the lookout for anything that could be helpful."
"2","Can you tell me about the various forms of literature that exist in this world?"
"14","Could you help me pick this lock?"
"2","There is so much to discover in this world."
"2","What is the crime rate like in this place?"
"9","Are you interested in attending a professional fist sparring training camp?"
"8","Would you like to learn some mace techniques with me?"
"13","Would a resource exchange work for you?"
"13","Can we do a resource swap?"
"7","Let's improve our axe fighting with some practice."
"8","Let's go to the training ground and practice with maces."
"8","I'm excited to learn mace techniques from a skilled instructor."
"2","What is the art scene like in this place?"
"15","See if you can find any hidden treasures."
"8","We need to make mace training a priority. Let's practice together."
"7","Do you think axe training could help you in your line of work?"
"13","Let's barter for items or services."
"11","Push forward and strike in close combat!"
"4","How do you think I need to fight to gain respect?"
"15","Keep an eye out for any potential sources of warmth."
"10","Can you heal me, please?"
"5","What items or gear should I equip to complete this quest?"
"10","I need some divine intervention."
"10","I'm feeling stressed out and need some treatment to help me relax."
"15","Check out the nearby shops and boutiques."
"6","Let's begin sword training!"
"9","Let's focus on maintaining good posture in fist fighting."
"2","Can you tell me about the major historical events that have shaped this world?"
"10","Can health potions be used on other people?"
"5","How can I ensure that my work is compatible with the existing systems, tools, and platforms?"
"9","We need to train our power and accuracy for fist fighting. Let's go to the gym."
"8","How do you think mace training compares to other forms of fitness training?"
"6","Let's practice sword swings and thrusts."
"5","What should I do if I encounter unexpected roadblocks while trying to complete this task?"
"5","What completion criteria should I use to measure how well I did the task?"
"5","What skills do I need to complete this task?"
"8","Have you ever combined mace training with other forms of exercise?"
"15","Work in pairs to search the area more quickly and effectively."
"3","Could you reiterate the main goal of the mission?"
"10","Would it be possible for you to lend me a first aid kit?"
"1","Tell me about the pivotal decisions that have led you to where you are now."
"3","What is the current objective that we're working towards?"
"8","Come on, let's train with maces!"
"4","How can I effectively use my environment in a melee battle?"
"10","Help me ease my emotional pain"
"10","Are health potions expensive to obtain?"
"1","How did you develop your skills and expertise?"
"12","Our ranged fighters can deal damage to the enemy before they even reach us."
"8","Let's focus on our mace aim."
"4","Do you think I need to be more strategic in my approach to fighting?"
"5","How can I ensure that I meet all the requirements for this task?"
"11","Use your opponent's momentum against them!"
"15","Explore the territory and find its hidden gems."
"13","Would you be willing to exchange goods with me?"
"11","Use your momentum to power your attack!"
"2","Can you tell me about the different types of media that are used in this world?"
"15","Check the area for any potential assets."
"1","Share your story of finding happiness and fulfillment in the present moment."
"7","Take your axe and let's begin the training!"
"9","Would you like to learn some self-defense moves?"
"8","Let's train with the mace and get better."
"11","We need to be prepared for anything when going into close combat."
"14","Hack the lock and let's get out of here."
"1","Can you describe your approach to conflict resolution with customers or clients? Tell me about a time when you successfully resolved a conflict with a customer or client."
"8","Have you attended any mace training classes or workshops?"
"3","Can you tell me what our current assignment is?"
"3","What are we hoping to achieve with our current mission?"
"2","The world is a complex and interdependent system, where everything is connected and affects everything else."
"10","Please help me rise above my pain"
"4","How do you know when to throw in the towel during a fight?"
"13","Let's barter."
"13","Please display your inventory for me."
"4","Do you have any suggestions for fighting against enemies who are highly trained in combat?"
"13","Could you please show me your inventory?"
"9","We should practice different techniques in fist fight training."
"7","Do you want to develop your axe skills?"
"4","How do you recommend I handle enemies who are heavily armored but slow-moving?"
"2","How has the world changed since the advent of the internet?"
"5","What techniques have you used in the past to successfully complete similar tasks?"
"15","Pay attention to any sounds or smells as you survey the area."
"10","I need to find the right treatment for my chronic fatigue syndrome."
"6","Take up your sword and let's start training."
"12","Shooting a bow is one of my skills."
"2","Can you tell me about any local charities or nonprofit organizations in this place?"
"8","Let's push ourselves to the limit during mace training."
"14","Is it hard to pick a lock?"
"3","Can you explain what our current task is?"
"4","How do you think I need to fight against cybercrime?"
"5","Can I delegate any part of the task to someone else?"
"2","What can you tell me about the mysteries of this world?"
"9","Let's improve our stamina through fist fight sparring."
"10","A little healing goes a long way, heal me up."
"7","It's time to become a true axe warrior!"
"7","It's time to level up our axe skills, let's practice."
"5","Are there any particular resources I should utilize to complete this task?"
"15","Don't let the day go to waste, let's explore the place nearby."
"15","Focus your search on areas that are more likely to hide what you're looking for."
"10","I feel like I might faint"
"7","Let's begin practicing with the axe."
"6","How about studying the history of sword training styles?"
"13","Let's exchange resources to support each other."
"3","Get straight to the point and tell me what we're trying to achieve."
"5","What training do I need to get better at completing this task?"
"13","Would you be interested in exchanging equipment?"
"11","It's time to engage in close combat."
"10","Are health potions effective for healing injuries?"
"9","Time to put your fists up for some sparring."
"6","Train hard and become a true swordsmaster."
"15","Focus your search on areas that are more sheltered from the elements."
"7","How about axe training for a unique and exciting date idea?"
"1","I'm interested in learning more about your problem-solving skills. Can you tell me about a time when you came up with a creative solution to a difficult problem?"
"2","How does this world deal with issues related to health and well-being?"
"3","What are the potential risks for our organization if our current task fails?"
"4","Can you recommend some combat tactics for dealing with multiple attackers?"
"7","How about axe training to feel empowered and confident?"
"7","Let's practice our axe swings and strikes."
"6","Start your sword training now."
"15","See if there's anything that could give us an edge."
"11","Let's get in there and give them a taste of their own medicine."
"5","Can you suggest any strategies for completing this task efficiently?"
"9","We need to refine our fist fight strategy."
"9","Would you like to incorporate fist fighting into our regular workout regimen?"
"10","I have a sexually transmitted infection and need to find the right treatment."
"7","Let's practice our axe thrusts and chops."
"9","Would you like to attend a fist sparring workshop with experts?"
"4","What are some strategies for conquering a heavily fortified enemy position during a battle?"
"9","Experiment with different training partners to gain experience with different fighting styles."
"8","I want to improve my mace skills."
"7","How can practicing with an axe benefit you?"
"13","I want to see what items you're carrying in your inventory."
"9","Let's improve your fist fighting skills!"
"14","Let's see your hacking skills in action on this lock."
"3","What is the main mission of our current undertaking?"
"9","Let's put on our gloves and start training our punches and kicks."
"10","I think I have an infection, I need to get treatment soon."
"7","Are you interested in developing your axe coordination?"
"9","Can we try some new footwork during our fist sparring practice?"
"6","Take your sword and start your training journey."
"7","Let's start your axe skill-building."
"13","I'm willing to trade resources that I no longer need."
"1","Share your story of finding inner peace and contentment."
"1","Tell me about the people who have supported and encouraged you on your journey."
"6","Begin with sword training footwork and posture."
"5","Can you suggest any tips to help me complete this task within the given timeline?"
"9","Let's work on our explosive power for fist fighting."
"15","Don't give up if you hit a dead end."
"2","What do you think is the most significant cultural event in the history of the world?"
"5","How do I track my progress in completing this task?"
"7","Begin your axe training with a desire to be the best."
"11","We need to close the gap and get in their face."
"9","It's okay to take breaks during fist fight sparring if needed."
"2","This world is full of both individuality and community."
"5","What is the best approach to take when starting this task?"
"10","Are health potions sold in this area?"
"1","What are your beliefs about the role of social responsibility and sustainability in business, and how do you integrate those values into your work?"
"7","Let's train for the upcoming axe tournament."
"6","How about incorporating sword training into your fitness routine?"
"4","How do I fight against financial struggles and debt?"
"10","Is my vision blurry?"
"12","I am proficient in shooting a bow."
"5","How do I manage and mitigate those risks?"
"15","Be careful not to overlook anything as you search the area."
"6","Would you like to study sword fighting philosophy?"
"7","Grab your axe and let's start practicing."
"5","What strategies should I use against the final boss of this quest?"
"4","What are the best ways to deal with enemies who are constantly on the defensive?"
"13","Are you open to exchanging resources for mutual gain?"
"11","Close combat is where we can make a statement."
"5","What contingencies should I have in place to ensure I finish this task on time?"
"1","What are your thoughts on customer service? Can you tell me about a time when you went above and beyond to provide excellent customer service?"
"4","How important is physical fitness for fighting?"
"13","Let's do an equipment trade."
"1","How did you find the motivation to keep going when things got tough?"
"2","Tell me what you see when you look at this world."
"8","Join me for some mace fighting drills."
"15","Begin searching the area for any signs of life."
"10","Is there any chance I could borrow your first aid kit?"
"8","How do you think mace training compares to other forms of strength training?"
"3","Can you bring me up to speed on our current task?"
"8","Mace training will help me build my endurance and stamina."
"13","May I see your inventory list?"
"8","Shall we give mace training a shot?"
"14","Tap the lock of the chest with a hammer to loosen it."
"9","Don't forget to rest and recover after training!"
"3","What task needs to be accomplished in the near future?"
"4","How can I improve my battle tactics?"
"12","Don't hesitate, shoot them down!"
"4","How can I utilize the element of surprise to my advantage during a battle?"
"5","What steps do I need to take to finish this project?"
"5","Can I repeat this quest for rewards?"
"1","Describe the moments that have tested your resilience and challenged you to grow."
"11","Close combat requires careful observation of your opponent."
"9","Use visualization techniques to prepare for different scenarios and opponents."
"3","What is the primary objective we are striving to achieve?"
"13","I think it's a good idea to share resources."
"4","Are there any self-defense classes you recommend?"
"11","Advance and engage the enemy!"
"15","Embark on a journey to explore the territory."
"2","How do people typically spend their time in this place?"
"1","Tell me about a time when you had to adapt to a significant change or challenge in your work environment, and how you navigated that situation."
"4","How do I fight against war and conflict?"
"15","Let's see what's on the other side of the woods."
"3","I'm not interested in hearing anything else. Just tell me the essence of our current mission."
"4","What's the best way to avoid getting into fights altogether?"
"8","How do you feel about trying some mace exercises?"
"11","Engage in close combat and don't give them any room to breathe."
"5","How can I measure my progress and quality of work throughout the task completion process?"
"8","I want to become a better mace fighter. Will you practice with me?"
"13","Let's exchange resources to explore new areas."
"6","Let's become proficient swordsmen through training."
"1","What are your thoughts on the role of mentorship and professional development in career growth and success, and how have you sought out or provided mentorship in your own career?"
"13","Are you open to exploring a resource exchange with me?"
"1","Can you tell me about a time when you had to handle a difficult situation with a co-worker who was not performing up to expectations?"
"3","What is the ultimate outcome we're hoping to attain?"
"8","Have you noticed any changes in your body composition since starting mace training?"
"15","Start your survey from the left side of the area."
"5","How do I communicate with others involved in this task?"
"8","Let's hone our skills with the mace."
"13","I'm interested in doing an equipment trade."
"1","How did you discover your unique path in life and follow it with conviction?"
"12","Shoot from afar!"
"9","Let's have a friendly competition through fist fight sparring."
"15","Let's create memories and explore the nearby place."
"4","What's your recommended method of fighting against economic inequality?"
"1","What are your thoughts on work-life balance? Can you tell me about a time when you had to balance work responsibilities with personal commitments?"
"6","How about practicing sword training dexterity with your non-dominant hand?"
"5","Who can hold me accountable for completing this task?"
"10","Can you please help me heal my mind, body, and soul?"
"5","What are the key features of completing this task to a high standard?"
"2","How do you describe the world we live in?"
"9","Work on your upper body strength with pushups and pullups!"
"3","What is the end result we are aiming for with our current mission?"
"15","Search for any materials that could be used to construct a trap or defense mechanism."
"8","Do you think mace training would be suitable for all fitness levels?"
"1","Can you share the story of how you discovered your calling?"
"7","Let's train for the axe competition with some practice."
"3","What is the end result we are hoping for with our current mission?"
"10","Heal my pain"
"1","How did you learn to navigate difficult emotions and situations with grace and compassion?"
"9","We'll be unstoppable in a fist fight with proper training. Let's start today."
"13","Let's exchange some of our possessions."
"15","Delve into the unknown and explore the territory."
"6","Let's focus on our swordplay and get better."
"10","Can I use any environmental elements to my advantage with low health"
"2","This world is home to a wide variety of flora and fauna, tell me about them."
"10","Heal me like a pro!"
"14","Smash the glass on the door and reach in to unlock it!"
"2","Can you describe a place in the world that is famous for its unique ecosystem?"
"12","Stay out of harm's way and attack from a distance!"
"1","Tell me about a time when you had to confront a difficult truth or feedback about yourself in order to grow and improve in your work."
"15","Take pictures of interesting sights."
"2","What's the community like in this place?"
