"1","I'd like to know more about your interpersonal skills. Can you tell me about a time when you effectively communicated with someone from a different background?"
"9","We should incorporate sparring into our fist fight training."
"3","What is the end goal of our current mission?"
"10","Can you please use your healing herbs?"
"6","We should spend some time training with swords."
"10","Is there a way to fight effectively with little health left?"
"1","Share your story of overcoming self-doubt and stepping into your power."
"13","Do you want to exchange equipment with me?"
"6","Let's work on your sword fighting skills."
"1","Describe the moments that have taught you the value of resilience and perseverance."
"3","What is the task that we need to complete before anything else?"
"12","Shoot that target down!"
"4","How do I fight against environmental degradation and climate change?"
"5","How can I approach this task with a positive attitude?"
"15","Keep a lookout for any potential dangers as you search the area."
"11","Use your opponent's guard to set up your next strike!"
"8","Let's begin our mace training with some conditioning."
"5","Can you suggest any creative solutions for completing this task?"
"5","What is the expected outcome of completing this task?"
"11","Are you ready to engage in close combat?"
"15","Scan the area for any potential hazards."
"7","Do you want to see what axe training is all about?"
"8","Begin mace training by practicing your posture."
"15","Consider bringing in a team of experts to help with the search."
"13","Let's trade equipment."
"7","How about axe training to improve your precision and accuracy?"
"7","Start your axe training with enthusiasm."
"10","I have a chronic pain condition and need to find the right treatment."
"8","I want to become a mace fighting prodigy."
"2","Can you tell me about the transportation options in this place?"
"8","Have you ever noticed any improvements in your grip strength since starting mace training?"
"8","Don't procrastinate, let's practice with the mace!"
"14","Don't be afraid to use your hacking abilities to unlock the door."
"9","It's time for some intense fist fight sparring."
"3","What is the task that we are supposed to be completing at the moment?"
"12","I can shoot a bow while moving."
"3","Can you fill me in on our current task?"
"13","Sharing resources can benefit us both."
"7","How about axe training to learn a new hobby?"
"8","Can you recommend any good mace training programs or coaches?"
"3","What is the end result we are striving for with our current mission?"
"1","What are your thoughts on diversity and inclusion in the workplace? Tell me about your experience working with a diverse team."
"10","Can you please help me feel better?"
"10","Do you have any final advice on the use of health potions?"
"11","Close combat is where we can make a difference."
"14","Your task is to hack this lock, no matter what it takes."
"4","How do you think I need to fight against censorship?"
"14","Apply a hammer and punch to the lock of the chest to try and dislodge it."
"8","It's time to hone our mace fighting abilities. Let's go practice."
"13","Please show me your inventory."
"7","Start your axe training and stay persistent."
"3","What is the expected outcome of our current mission?"
"9","How about a fist sparring session with some techniques?"
"13","Can you show me what's in your inventory?"
"5","How do I avoid the final boss's attacks in this quest?"
"11","Get in their face and attack with ferocity!"
"7","Do you want to improve your axe combat abilities?"
"14","Can you pick a lock with a diamond pick?"
"2","This world is a beautiful and complex tapestry of cultures and landscapes."
"11","Don't let them intimidate us in close combat."
"8","I want to improve my mace fighting abilities. Will you practice with me?"
"1","How did you learn to let go of perfectionism and embrace your imperfections?"
"13","Would you like to barter for some resources?"
"1","What are your thoughts on continuous learning and development? Can you tell me about a time when you learned a new skill or gained new knowledge?"
"1","What led you to develop a sense of purpose and meaning in your life?"
"4","Do you recommend practicing visualization techniques to improve my fighting abilities?"
"14","Can you hack this lock without leaving a trace?"
"4","How do you choose which fighting style is right for you?"
"12","Use your ranged abilities to draw your enemies into traps!"
"15","Search the area from different angles to catch anything you might have missed."
"7","Are you curious about mastering the axe?"
"14","This lock is no match for your hacking skills."
"1","What led you to prioritize your mental and emotional health?"
"4","How can I exploit the weaknesses in the enemy's battle plan to secure victory?"
"5","What practices can I put in place to ensure that the outcome of the task meets the objectives?"
"11","Attack the enemy's limbs to disable them!"
"5","How do I manage that last % of the task that feels like it takes % of the time?"
"13","Would you like to do a resource swap for mutual benefit?"
"10","Can you spare some healing?"
"3","Our mission is to provide access to affordable and renewable energy for all."
"5","What are some tips you can give me to complete this task quickly?"
"11","Close combat is where we can make the difference between victory and defeat."
"15","Look out for items that can be repurposed."
"15","Use a ladder to search high-up areas in the area."
"10","Do you know of any first aid kits that are easily accessible?"
"8","I want to develop my mace footwork."
"9","We need to practice our footwork and timing for fist fighting. Let's go train!"
"3","Can you outline the scope of our current task?"
"7","Let's have a mock axe battle."
"12","Focus on accuracy and fight in ranged combat."
"13","Can we swap some materials?"
"8","Can practicing with the mace improve your posture?"
"12","Take cover and shoot from a distance!"
"11","Attack with a combination of strikes and throws!"
"5","Can you give me some tips for completing this task more efficiently?"
"8","Let's begin the mace training with some balance exercises."
"14","Can you pick a lock with a hook pick?"
"7","Don't be afraid to swing that axe, start your training!"
"4","What are the most successful tactics for a blitzkrieg-style offensive in battle?"
"10","Heal me up, doc!"
"15","Investigate any strange noises."
"3","Let's refocus on the essential elements of the mission."
"10","Are there any risks involved in using health potions?"
"10","My body is achy all over"
"6","How about building your endurance with sword training drills?"
"1","Tell me about a time when you had to take a calculated risk in your professional life, and how you weighed the potential benefits and drawbacks of that decision."
"9","Always train with safety in mind to avoid injury and stay healthy."
"3","The essence of our mission is to promote democracy and good governance."
"9","Work on your timing and precision!"
"9","We need to work on our defense in fist fighting."
"4","How can I use my surroundings to my advantage in a fight?"
"15","Let's explore the place nearby and make it our own."
"7","If you want to be a true warrior, you need to start your axe training!"
"8","I want to become proficient with the mace."
"7","It's time to unleash your inner warrior with the axe!"
"1","What led you to pursue a career that aligns with your values and passions?"
"4","How do I effectively use siege weapons in my battle tactics?"
"5","What challenges do I need to overcome to complete this quest?"
"2","The world is a playground of possibilities and opportunities."
"2","What do you think is the most important issue facing the world's polar regions?"
"9","Keep your guard up and protect yourself at all times!"
"14","Use a spear phishing attack to bypass the lock's security."
"1","What led you to pursue your passions and make them your life's work?"
"10","Can health potions cure any type of injury?"
"3","What are the key milestones of our current mission?"
"11","Attack with speed and surprise!"
"2","The world is a garden of different emotions and feelings."
"5","Who can help me complete this task?"
"7","Start your axe training without delay."
"9","Are you up for a little bit of friendly competition with some fist sparring?"
"8","Ready to take your mace skills to the next level? Let's train."
"13","Let's see if we have anything we can exchange."
"8","Mace combat is my preferred fighting style."
"9","It's time to learn new fist fighting techniques. Let's train together."
"7","Take up your axe and start training!"
"1","Share your story of personal growth and learning from mistakes and failures."
"15","Let's check out the local bar and see what's on tap."
"2","How has the world of advertising impacted our understanding of conservation?"
"9","Shall we have a friendly fist sparring match?"
"3","What is the goal of our current mission?"
"10","My skin is clammy and cold"
"13","Are you open to a resource swap?"
"1","I'm interested in learning more about your training and development skills. Can you tell me about a time when you successfully developed a training program for your team?"
"7","Have you ever received training on how to use an axe?"
"8","Let's start our mace training!"
"13","I have some items that I'm willing to exchange."
"7","Let's work on our axe skills until we're the best of the best."
"3","Can you remind me what we're trying to achieve right now?"
"5","Should I bring any specific gear for this quest?"
"15","Keep your eyes open for any valuable resources."
"9","Train with different sized and skilled opponents for variety!"
"3","What is the task that we are supposed to be completing right now?"
"1","Share your story of discovering your strengths and overcoming your weaknesses."
"15","Keep your eyes peeled and search the area for anything out of place."
"13","Let's exchange resources to enhance our productivity."
"8","Grab your gear and let's work on our mace skills."
"1","Can you tell me about a time when you had to handle a difficult situation with a client or customer?"
"7","Shall we train with the axe today?"
"6","We should practice swordsmanship to become better fighters."
"8","Are you curious to see how mace training can improve your combat skills?"
"9","Let's see what you're made of with fist fight training!"
"3","I can't remember what we're supposed to be doing. Can you remind me?"
"11","It's time to get in their face and fight."
"5","How can I measure the impact of completing this task?"
"10","I feel like I might pass out at any moment"
"10","Can you survive without using health potions?"
"9","Let's practice our striking accuracy and precision for fist fighting."
"11","Close combat requires quick reflexes and agility."
"9","Do you want to work on your close combat skills?"
"5","What are the potential benefits of completing this task successfully?"
"3","What is our mission for the upcoming month?"
"13","Can we exchange equipment that we don't use anymore?"
"13","Let's exchange resources to optimize our resource allocation."
"6","Start your sword training and become a master."
"2","What stands out to you the most about this world?"
"14","Can you pick a lock with a tension tool and ball pick?"
"3","Can you clarify the details of our current task?"
"9","Would you like to do some hand-to-hand combat training with me?"
"2","Can you describe a moment when you felt the power and majesty of the natural world?"
"8","How can mace training be adapted for individuals with disabilities or injuries?"
"10","I'm feeling unwell, I think I need some treatment."
"8","Let's get some mace training in."
"6","Start your sword training regimen today."
"12","Launch a surprise long-range attack."
"14","Hack the lock and access the valuable information inside."
"7","Would you like to hone your axe abilities?"
"1","Tell me about a time when you had to navigate a challenging ethical situation in your work, and how you approached that dilemma."
"4","How do you recommend fighting against human trafficking?"
"3","What are the desired outcomes for our current task?"
"5","How can I stay motivated while completing this task?"
"7","Let's perfect our axe swings and chops."
"3","What is our current role in the mission?"
"7","How about testing your axe proficiency?"
"1","What are your thoughts on workplace diversity and inclusion? Can you tell me about a time when you successfully promoted diversity and inclusion within your organization?"
"11","It's time to get close and show them what we're made of."
"13","Would you like to exchange resources that we don't need?"
"11","Close combat is not something to take lightly."
"13","I'm interested in seeing your inventory items."
"7","How about axe training to improve your balance and posture?"
"4","Do you believe in using only non-violent methods to resolve conflicts?"
"7","How can practicing with an axe improve your reflexes?"
"10","Heal me up and I'll be your loyal follower."
"13","Let's swap things that we have duplicates of."
"10","Can I borrow a first aid kit from you?"
"2","Can you tell me about the different types of peacekeeping efforts that have"
"12","Take the first shot and fight in ranged combat."
"8","Get ready to practice with the mace."
"11","Don't give the opponent a chance to catch their breath, keep attacking relentlessly!"
"3","What is our current strategy?"
"10","Do you carry a first aid kit with you?"
"2","What are some interesting facts about this place?"
"14","Use your knowledge of computer security to hack the lock."
"11","Attack with precision and accuracy in close combat!"
"3","What is our current assignment and its purpose?"
"7","Let's make axe training a regular part of our routine."
"6","Let's not waste any more time, it's time to train with the sword!"
"11","If we're going to win, we need to engage in close combat."
"6","Begin with sword training teaching and mentoring."
"14","Use a social media hack to obtain the lock's password."
"9","Let's practice our ground-and-pound technique for fist fighting."
"7","Begin your axe training with a strong will."
"10","I have a bladder problem and need to find the right treatment."
"9","Shall we grab some gloves and start practicing our fist fighting techniques?"
"4","How do I fight against political corruption and abuse of power?"
"12","Focus on ranged attacks and stay out of melee range!"
"8","How do you swing the mace without hitting yourself?"
"6","Let's practice swordsmanship to become better sword fighters."
"11","We can't win from a distance - it's time to get up close."
"2","The world is a dance of energy and matter."
"2","What are some of the biggest challenges that this world has faced throughout history?"
"1","How did you learn to embrace your strengths and weaknesses?"
"10","My chest feels tight and heavy"
"10","Are there any risks associated with making a health potion?"
"13","Can we arrange a resource swap?"
"1","I'd like to know more about your leadership experience. Can you tell me about a time when you had to lead a team through a challenging project?"
"6","Train with your sword like your life depends on it."
"2","What are some of the most important technological advancements that have been made in this world?"
"13","I'm interested in exchanging some of my possessions for yours."
"4","How do you think I need to fight for the love of my life?"
"2","Can you tell me about any festivals or events that take place in this place?"
"1","How did you identify your passions and turn them into a career?"
"5","What is the best way to adapt to changes in the task requirements?"
"15","Survey the area from the highest vantage point."
"2","What's the culture like in this place?"
"13","Let's exchange resources to expand our network."
"15","Be sure to search all nooks and crannies of the area thoroughly."
"2","The world is home to millions of species, each with their unique characteristics and behaviors."
"4","What are some good ways to practice countering attacks in combat?"
"13","Can we arrange a resource exchange that works for both of us?"
"10","Do health potions work on magical injuries?"
"5","What are the potential roadblocks that I might encounter while completing this task and how can I navigate around them?"
"7","Let's see what you're made of with some axe training!"
"13","Can we do an equipment trade?"
"5","How can I overcome the challenges in this task?"
"2","The world is full of mysteries waiting to be solved."
"3","What is the objective of the current project we're working on?"
"13","Do you want to do a resource exchange?"
"3","What are we working towards right now?"
"14","Use a hydraulic cutter to chop through the door!"
"7","Don't procrastinate, begin your axe training now!"
"8","How does mace training affect your cardiovascular endurance?"
"7","Let's start your axe strategy training."
"3","What is our focus for the current phase of the project?"
"11","Use your peripheral vision to stay aware of the opponent's movements!"
"8","Let's focus on our mace form and technique."
"1","Can you tell me about a hobby or interest that you are particularly passionate about?"
"9","Mix up your training with other martial arts to gain a broader range of skills."
"13","I'm looking to exchange some of my equipment to diversify my gear."
"13","Can we do an equipment exchange and upgrade our gear together?"
"10","Do you carry a first aid kit on you?"
"1","Can you tell me about a time when you had to prioritize multiple tasks and how you managed to complete them all?"
"11","We can't keep fighting from a distance, let's engage in close combat."
"4","What are some good ways to analyze an opponent's fighting style in combat?"
"4","What are the best ways to deal with enemies who are skilled at parrying and blocking attacks?"
"8","I want to learn advanced mace techniques."
"11","Use your experience to anticipate the opponent's movements and attack accordingly!"
"11","Push your opponent back with a powerful attack!"
"12","Let's take them out from a safe distance!"
"15","Use a flashlight to search the area for any hidden clues."
"6","Let's practice sword fighting and sharpen our skills."
"4","What are some tactics for getting out of a disadvantageous position in combat?"
"3","What are the specific targets of our current mission?"
"9","Are you interested in learning some ground and pound techniques?"
"3","What is the purpose of our current undertaking?"
"1","How did you overcome challenges and adversity to achieve your goals?"
"8","Let's sharpen our mace fighting abilities."
"11","Use footwork to avoid the enemy's attacks and set up your own!"
"14","Break open the chest with a crowbar."
"8","Join me for some mace practice."
"14","Apply a bump key to pick the lock of the chest."
"6","Let's get serious about sword training, follow me!"
"10","Heal me with your holy touch."
"12","Draw your bowstring and shoot it!"
"4","How do I determine which battle tactics are most effective?"
"8","Grab your mace, and let's work on our skills together."
"14","Pry the door open with a pry bar!"
"12","Use your bows to bring down the enemy!"
"5","How much time do I have to complete this task?"
"13","I have some equipment I'd like to trade with you."
"1","Tell me about a time when you had to navigate a complex regulatory or compliance issue, and how you managed that process."
"14","Pry the chest open with a pickaxe."
"14","Hack the lock and reveal its secrets."
"6","Let's have a friendly sword fight practice."
"15","Survey the area in a clockwise direction."
"9","Can we try a fist sparring game with different opponents?"
"1","How did you find the courage to pursue what you truly wanted in life?"
"6","Train with the sword for endurance!"
"14","Use a reverse engineering attack to understand the lock's mechanism."
"13","I want to exchange my things for something that you have."
"14","With your hacking knowledge, we'll be inside in no time."
"3","What are we trying to accomplish right now?"
"14","Use a screwdriver to pry open the chest."
"6","Let's not miss this opportunity to train with the sword, let's go!"
"13","Let's discuss exchanging resources."
"13","Sharing resources is a smart way to collaborate."
"2","What do you think is the most important issue facing the world's coral reefs?"
"3","What are the specific requirements of our current task?"
"13","I want to trade with you."
"6","Do you want to become a skilled sword fighter through practice?"
"15","Search for any items that can be used to make a compass or navigation tool."
"9","Let's meet up and practice our punching and dodging."
"13","Sharing resources can help us both succeed."
"13","Can we share resources and make a positive impact in the world?"
"5","What's the best approach to finish this task?"
"5","How can I keep track of my progress while completing this task?"
"13","I believe we can both gain from exchanging resources."
"4","What are some strategies for fighting in close quarters?"
"8","Get ready to work up a sweat, it's time to train with the mace!"
"10","I feel like I've been hit by a truck"
"1","What inspired you to pursue your current passion?"
"11","Going into close combat means getting up close and personal."
"7","Get started on your axe mastery."
"3","What is the mission statement we're working towards?"
"2","How has the world of politics shaped the way we see the world?"
"10","Is my hearing impaired?"
"4","Should I focus on ground fighting or stand-up fighting in my style?"
"11","We'll have to fight up close if we want to win this."
"7","Start your axe training routine."
"15","Visit the nearby coffee shop for a cup of coffee."
"9","Practice evading and slipping techniques to avoid your opponent's attacks."
"7","Begin your axe training with a thirst for knowledge."
"15","Go down the street and see what's there."
"11","Take advantage of any opening and attack!"
"7","How about axe training to improve your confidence in handling tools?"
"14","Use a hydraulic press to crush the chest open."
"3","What is the underlying reason for this mission?"
"5","Can I complete this quest alone or do I need a team?"
"6","Take the first step in your sword training journey."
"14","Create a phishing attack to obtain the lock's password."
"2","The world is a journey of both joy and sorrow."
"7","Do you want to try some axe chopping exercises?"
"4","What are some ways to stay calm and focused during a fight?"
"6","Get your sword and start training."
"6","Would you like to learn different sword forms?"
"12","Let's show them the power of ranged combat!"
"1","How did you find the courage to pursue your dreams despite the fear of failure?"
"4","How should I approach combat in this situation?"
"11","It's time to put our close combat training to use."
"11","Aim for the opponent's limbs to weaken their defenses!"
"9","Let's focus on developing our mental toughness in fist fighting."
"6","Let's practice our sword techniques and become better fighters."
"12","Use your bow to shoot them down before they get close!"
"6","Enhance your sword skills!"
"10","I'm experiencing numbness and tingling in my fingers"
"2","Tell me about the role of media and communication in this world."
"9","Can we have a fist sparring challenge with some agility drills involved?"
"7","It's time to begin your axe training."
"3","What are the objectives we are trying to achieve with our current mission?"
"6","Start your sword training and develop your skills."
"10","Do health potions restore all health or just a portion?"
"7","Have you ever had the chance to practice with an axe?"
"11","Close combat can be intimidating, but we can handle it."
"2","The world is a constantly shifting and unpredictable place."
"5","Can you recommend any additional tools or software to help me complete this task?"
"12","I have a collection of different types of bows."
"7","How about axe training to develop a new passion or hobby?"
"6","Have you developed your own sword fighting style?"
"5","How do I access the hidden area for this quest?"
"7","Let's train for hand-to-axe combat."
"8","I want to learn how to use a mace properly."
"1","Share your story of overcoming self-doubt and building confidence."
"3","Can you summarize the critical factors for success in this project?"
"9","It's time to become more versatile in fist fighting."
"13","Shall we exchange resources?"
"10","Heal me with your divine power."
"9","Shall we train in some basic jiu-jitsu techniques?"
"10","Give me your healing energy."
"3","What is the end goal of our current undertaking?"
"13","How about we do a trade?"
"14","This lock won't stand a chance against your hacking skills."
"13","Let me see your inventory, please."
"6","The sword won't master itself, let's go train!"
"14","Use a stethoscope to listen for the tumblers in the lock on the chest."
"13","I have some things that I'd like to trade with you."
"4","What's your opinion on using feints and misdirection in combat?"
"13","Let's switch some equipment."
"10","My nose is stuffy and congested"
"1","What led you to pursue a life of creativity and self-expression?"
"3","No time for ambiguity, state the mission's purpose clearly and directly."
"3","What are the key performance indicators for this project?"
"14","Have you ever picked a lock before?"
"15","The nearby place has so much to offer, let's explore it all."
"9","Would you like to learn some advanced grappling and submission techniques?"
"3","Can you outline the details of our current mission?"
"12","Take advantage of your ranged abilities and attack from a distance!"
"1","Describe the path that led you to your current role and responsibilities."
"7","Do you think practicing with the axe is important?"
"1","What are your beliefs about the role of purpose and meaning in your work, and how do you ensure that your career aligns with your personal values and passions?"
"13","Can we negotiate a fair exchange of equipment?"
"7","Would you like to practice some axe techniques?"
"11","Use your opponent's momentum against them and strike!"
