"8","Begin mace training by learning the correct grip."
"3","What are the deliverables of our current mission?"
"14","Use a denial-of-service attack to disable the lock's system."
"1","Describe the moments that have taught you the importance of authenticity and being true to yourself."
"1","Can you tell me about your personal and professional life?"
"5","What skills do I need to complete this task successfully?"
"6","Should we practice sword fighting techniques first?"
"2","Can you describe a time when you witnessed a natural wonder that left you speechless?"
"15","Look for anything that might help us in our journey."
"10","Are you able to craft a health potion for me?"
"4","How can I use unconventional weapons or tactics to surprise the enemy during a battle?"
"1","Can you introduce yourself?"
"5","Should I complete the optional objectives for better rewards?"
"8","Let's spend some time working on our mace techniques."
"15","Keep your eyes peeled for any signs of useful items."
"6","Do you think sword training is a valuable skill to have?"
"9","Shall we try some partner exercises and drills during our fist fighting practice?"
"1","How did you find the strength to persevere in the face of adversity?"
"2","This world is full of both knowledge and mystery."
"6","How about increasing your speed with sword training exercises?"
"10","How long does it take to recover my health naturally? I have little left."
"12","Our ranged fighters can create a barrage of arrows in ranged combat."
"13","How about we exchange things we have in surplus?"
"14","We need your hacking skills to bypass this lock."
"15","Don't overlook any potential sources of food, no matter how small."
"10","Would it be too much to ask for a first aid kit from you?"
"3","The essence of our mission is to promote creativity and the arts."
"3","I require a concise and focused explanation of our mission's goal."
"2","The world is a place of great diversity and conflict, as people from different backgrounds and cultures clash over ideas, beliefs, and resources."
"11","Strike from an unexpected angle in close combat!"
"9","Are you ready for some fist fighting practice?"
"15","Take a walk around the neighborhood and say hello to the neighbors."
"2","The world is a complex system of interactions and feedback loops."
"4","How do you avoid getting hit during a fight?"
"9","Train like a champion in fist fighting!"
"2","Can you tell me about the different cultures that exist in this world?"
"11","Don't let the opponent catch their breath, keep attacking!"
"3","What are the resources required for our current mission?"
"4","How important is strategy in combat?"
"6","Let's work on our swordplay to become better warriors."
"9","Shall we practice under various fatigue levels for better endurance in a fist fight?"
"2","The world is a playground of different games and challenges."
"1","What led you to pursue a life of purpose and meaning?"
"9","How do you feel about practicing some throwing and takedown techniques?"
"13","Can I take a look at your inventory?"
"8","Are you open to trying out some mace techniques to see if they work for you?"
"2","How would you explain this world to someone who has never seen it?"
"15","Let's go on an adventure and explore the nearby place together."
"10","Do you have any tips on finding health potions in hidden locations?"
"7","Time to start training with the axe."
"6","Ready to become a master with the sword? Let's start training!"
"7","Let's get better with our axe control."
"9","Let's go fist fight train and practice blocking and evading."
"4","How do you think I need to fight to achieve my dreams?"
"3","What are the expectations for our current task?"
"11","Use your grappling skills to close the distance and attack!"
"11","Focus your attacks on one area of the body!"
"6","Let's practice sword fighting for a while."
"8","I want to become a mace-wielding force to be reckoned with."
"6","Follow me, we're going to train with the sword."
"14","Use a chainsaw to cut through the door!"
"7","Have you ever used an axe to clear a path in the woods?"
"6","Would you like to learn the art of sword making?"
"14","Use a remote code execution attack to bypass the lock's security."
"2","The world is full of contrasts and contradictions."
"10","Do I look like I'm having trouble focusing?"
"13","I'm open to swapping equipment."
"9","Do you think we should practice with varying levels of intensity and resistance during our fist fighting practice?"
"15","Scan the vicinity for any useful resources."
"9","Are you interested in learning some new self-defense tactics using only your fists?"
"15","Be on the lookout for anything that can be used for shelter."
"7","Do you have a favorite brand of axe to practice with?"
"4","Do you have any advice for fighting against magic users?"
"3","What is the current assignment that we need to complete?"
"14","Can you pick a lock with a dimple lock pick?"
"2","What do you think is the most significant social achievement in the history of the world?"
"5","Can you provide any examples of similar tasks that were completed successfully?"
"1","What are your thoughts on problem prevention? Can you tell me about a time when you identified a potential problem and took steps to prevent it?"
"8","How often do you incorporate mace training in your workouts?"
"7","Time for some axe training."
"14","Can you pick a lock with a snake rake?"
"5","How do I use the different items acquired during this quest?"
"8","Would you like to add mace training to our routine?"
"7","Are you curious about axe training?"
"6","Are you interested in training with swords to improve your skills?"
"4","How can I improve my fighting technique?"
"4","How do you think I need to fight for my passion?"
"13","How about we barter our equipment?"
"4","Do you have any advice for fighting against enemies who are immune to certain types of damage?"
"6","Ready, set, start your sword training."
"5","How can I handle stress and pressure around completing this task?"
"3","What is the target outcome of our current mission?"
"6","How about learning defensive sword training techniques?"
"6","How about starting sword training tomorrow?"
"15","Divide the area into smaller sections to make your survey more manageable."
"11","It's time to get up close and personal with our enemies."
"7","It's time to start your axe training."
"5","How do I stay motivated to complete this task?"
"9","We need to train our stamina and endurance for fist fighting. Let's go for a run!"
"5","What are the common pitfalls I should avoid while completing this task?"
"10","Is it normal to feel this dizzy?"
"8","Our mace training will be intense, let's go!"
"3","What is our objective for the current stage of the project?"
"2","Can you tell me about a moment when you felt a deep sense of appreciation for the world?"
"5","How can I break down this task into smaller, more manageable steps?"
"15","Look around and see what you can find."
"7","Go ahead and begin your axe training adventure."
"4","Do you think I need to be more aggressive in my fighting style?"
"9","We can work on specific techniques during our fist fight sparring session."
"11","Land a heavy blow and follow through!"
"10","I'm feeling light-headed and unsteady"
"4","What are some good combat tactics for a beginner?"
"10","Should I prioritize my health over other stats in combat?"
"3","What is the intended outcome of our current work?"
"7","Begin your axe training regimen."
"1","Can you tell me about a skill you are currently working on improving?"
"13","Let's exchange some gear."
"4","What should I do if my opponent is stronger than me?"
"8","How does practicing with the mace benefit your core muscles?"
"12","Keep your cool and stay focused on ranged combat!"
"14","Can you pick the lock on this car door?"
"12","Take your position and fight in ranged combat."
"1","I'd like to know more about your creativity. Can you tell me about a time when you came up with an innovative solution to a problem?"
"8","Shall we practice our mace skills today?"
"11","We need to engage in close combat and use our agility to our advantage."
"3","What's our top priority at the moment?"
"7","Get ready to practice with your axe."
"2","This world is full of both innovation and tradition."
"10","I'm struggling to catch my breath"
"3","What's the significance of our current task?"
"9","Are you up for some combat training without weapons?"
"5","Can you help me establish a timeline for completing this task?"
"10","Can you spare a first aid kit for me to use right now?"
"2","The world is a place of both harmony and conflict, where different cultures and ideologies clash and interact."
"15","Search the surroundings for anything that could be beneficial."
"4","How do I fight against crime and insecurity in my community?"
"6","Grab your sword, it's time to train."
"7","How about axe training to challenge yourself mentally and physically?"
"6","We need to work on our sword skills to become better fighters."
"1","Can you describe your decision-making process? Tell me about a time when you had to make a tough decision."
"1","Describe the turning points that led you to where you are today."
"8","Have you seen any improvement in your strength since starting mace training?"
"7","It's time for some serious axe training, let's do it!"
"4","How do I effectively use archers in my battle tactics?"
"8","Let's start mace training with some stance work."
"14","Can you pick the lock on my suitcase?"
"3","What is the current task that requires our full attention?"
"4","How can I improve my reflexes for faster reaction time during the fight?"
"7","Let's work on our axe skills until they're perfect."
"1","What led you to pursue your passions and follow your dreams?"
"10","You have the power to heal me, please do."
"11","Attack high and low to keep the enemy guessing!"
"2","This world is both peaceful and chaotic."
"3","What is our current priority task?"
"13","Can we trade some items?"
"6","Do you want to improve your swordsmanship with me?"
"9","It's time to enhance our ability to adapt to different situations in fist fighting."
"10","Can you please use your healing affirmations?"
"12","I have studied the art of shooting a bow."
"14","The lock is no match for your hacking talents."
"3","What are the milestones of our current task?"
"8","I want to be able to switch between mace techniques seamlessly."
"12","Let's try fighting in ranged combat for a change."
"15","Search for any tools that can aid in our survival."
"10","Is there any chance I could get a first aid kit from you?"
"10","Would you recommend a health potion over a healing spell?"
"2","What do you think is the most pressing issue facing the world today?"
"7","Have you ever had any axe training before?"
"1","What are your thoughts on conflict resolution within a team? Can you tell me about a time when you successfully resolved a conflict within a team?"
"6","Begin with sword training solo drills."
"3","The essence of our mission is to promote volunteerism and community service."
"3","What are we trying to do with our current task?"
"2","Can you describe a piece of art that captures the essence of the world?"
"2","The world is a place of constant change, as natural disasters and climate change reshape our environment."
"1","Can you describe your conflict resolution skills? Tell me about a time when you successfully resolved a conflict in the workplace."
"12","I can shoot a bow accurately in low light conditions."
"10","Would you mind sparing a first aid kit for me to use?"
"8","Let's work on your mace technique together!"
"6","Want to work on your sword skills with me?"
"6","Time for a practice sword fight. Get ready!"
"7","Are you comfortable using an axe?"
"4","What's your recommended method of fighting against environmental pollution?"
"7","Let's see how far you can go with some serious axe training!"
"3","What's the reason behind our current mission?"
"14","Apply a magnet to the lock of the chest to try and dislodge it."
"5","Can you recommend any best practices for completing this type of task?"
"8","I want to train until I can wield a mace effortlessly."
"4","How do I develop my reaction time for fighting?"
"9","Would you like to improve your unarmed combat abilities?"
"15","Follow any trails you come across."
"7","Get focused and start your axe training."
"2","How has our understanding of culture impacted the way we see the world?"
"12","Stay out of the melee and snipe your enemies from a distance!"
"13","How about a resource exchange of equal worth?"
"11","Don't be afraid to engage in close combat, we have the skills to win."
"6","It's time for sword training."
"8","Let's work on our mace techniques."
"13","Can we exchange resources that we don't need?"
"11","Engage in close combat and don't give them any chance to escape."
"2","This world is full of both order and chaos."
"4","What are some battle tactics for fighting in dense forests?"
"13","Let's share resources and make the most of what we have."
"3","What's our main focus for this task?"
"15","Take note of anything you find as you search the area."
"10","Do you have a first aid kit that you could lend me for a minute?"
"2","What do you think is the most significant environmental achievement in the history of the world?"
"3","Our mission is to provide access to technology and information for all."
"5","Should I make a contingency plan for the task, and if so, what should it include?"
"3","What's our current assignment?"
"6","How about a friendly sword duel to sharpen our skills?"
"7","How about axe training to develop your problem-solving skills?"
"1","Tell me about the role models or mentors who have influenced your journey."
"12","Draw your bowstring and shoot!"
"3","What are the key deliverables for our current task?"
"11","Keep your opponent off balance with quick attacks!"
"6","Don't put off your sword training any longer - start now."
"5","What are the potential legal or regulatory implications of completing this task?"
"1","Describe your journey of self-discovery."
"13","Please open your inventory for me."
"1","What led you to pursue a life of authenticity and self-expression?"
"1","Tell me about the defining moments that have shaped your life's direction."
"13","Let's collaborate and exchange resources."
"4","What are some effective ways to evade an opponent's attacks in a fight?"
"15","Find anything that can be used to catch and cook food."
"3","What are we striving to achieve with our current mission?"
"4","What are some combat tactics to use in low-light conditions?"
"7","It's time to practice with our axes."
"1","Can you describe your approach to teamwork? Tell me about a time when you had to work with a team to complete a project."
"13","Can we exchange equipment to improve our inventory?"
"1","Tell me about the goals and aspirations that keep you grounded and focused."
"8","I want to become a mace combat master."
"13","I would like to see your available inventory."
"11","We need to be careful when going into close combat."
"9","We can't expect to win a fight without proper training. Let's start now."
"4","Do you think I need to work on my mental toughness to be a better fighter?"
"12","Hit the mark with your bow!"
"15","Check for any possible sources of entertainment in the area."
"2","How has the world of advertising impacted our understanding of environmental justice?"
"14","Can you pick a lock with a tension tool and diamond pick?"
"3","Can you recap the mission's critical success factors?"
"5","Can I replay this quest to earn more rewards?"
"14","We're relying on you to hack this lock and get us through."
"6","Do you want to hone your sword fighting skills?"
"2","What are the key features of this place?"
"7","Get ready to sweat - it's axe training time!"
"4","What are some battle tactics for fighting at night?"
"12","Aim for the sky and shoot your bow!"
"4","How do you recommend I deal with enemies who are highly skilled in magic?"
"14","Throw a brick through the door to break it down!"
"7","Shall we see how well you can wield the axe?"
"1","Can you walk me through your life's story and how it's led you to where you are today?"
"14","Hack the lock and let's get what we need."
"5","What are some common mistakes that people make while trying to complete this task, and how can I avoid them?"
"9","We can learn a lot about ourselves and our fighting style through fist fight sparring."
"8","Grab your mace and let's work on your coordination."
"14","Don't be shy, apply your hacking skills and open this lock."
"7","How about axe training to learn survival skills?"
"5","Is there anything specific I should do to complete this task?"
"5","How can I stay motivated while working on this task?"
"10","I'm feeling feverish and hot"
"12","Release your arrow and shoot!"
"3","The essence of our mission is to inspire and empower individuals to reach their full potential."
"11","Stay aggressive and keep attacking!"
"7","Grab your axe and let's get started with some serious practice."
"14","Use a blow dryer to heat up the lock on the chest."
"2","Can you tell me about the local businesses in this place?"
"2","This world is both fragile and resilient."
"3","What are the expectations for quality in our current task?"
"9","Would you like to join me for a fist sparring training camp?"
"15","Let's explore the territory together."
"5","Can I get feedback on my progress as I complete the task?"
"15","Explore the local area and see what's around."
"4","What are some effective grappling techniques?"
"1","I'm interested in learning more about your analytical skills. Can you tell me about a time when you had to analyze a large amount of data to make an important decision?"
"5","What choices do I need to make in this quest to complete it?"
"3","How does our current task fit into the bigger picture?"
"7","Let's perfect our axe swings."
"1","Tell me about a time when you had to confront a difficult conversation or give feedback that was challenging to deliver, and how you approached that situation."
"8","We need to work on our mace form, come on!"
"3","I require a straightforward and direct explanation of our mission's purpose."
"9","How do you feel about practicing some striking and counter-attacking moves?"
"15","Check for anything that could be repurposed."
"6","Follow me to the training area, we're going to train with the sword."
"12","I have learned different shooting techniques for different situations."
"6","Can we practice sword fighting with a blindfold?"
"4","How do you think I need to fight for my home?"
"4","Should I focus on improving my agility or quickness in my fighting style?"
"15","Let's see what's on the other side of the hill."
"2","How do you think the world would be different if everyone spoke the same language?"
"4","How do I fight against stress and anxiety?"
"10","I've been sick for a few days, I need to see a doctor for treatment."
"9","I want to push myself with some fist fight sparring."
"4","What are some ways to use momentum to your advantage in a fight?"
"7","Would you like to try some advanced axe techniques?"
"3","How does our current task align with our values as an organization?"
"8","I'm committed to mastering mace combat techniques."
"1","Can you tell me about the setbacks you've faced and how you overcame them?"
"11","Let's show them what we're made of in close combat."
"7","Let's practice with axes until it becomes second nature."
"6","It's time to train on sword techniques to become better soldiers."
"6","Sword training will help us become more confident fighters."
"9","Let's practice our clinch and grappling techniques for fist fighting."
"7","Let's have a practice axe fight to test our mettle."
"13","Let's pool our resources and achieve more."
"14","Use a lock pick gun to open the lock of the chest."
"15","We can't wait to explore the nearby place and see what it has to offer."
"7","Let's sharpen our axe skills."
"10","My joints are swollen and painful"
"1","Can you share with me your approach to setting and achieving goals, and how you measure success in your work?"
"5","How do I organize my time to focus on completing this task?"
"14","The lock is waiting for you to hack it open."
"15","Be sure to search every inch of the area."
"9","I want to train my coordination through fist fight sparring."
"14","Your hacking skills are needed to unlock this."
"14","Can you teach me how to pick a lock?"
"10","Can I please have a first aid kit since I hurt myself badly?"
"10","Do you have a first aid kit available for me to use?"
"12","Initiate a ranged skirmish."
"13","I'm interested in exchanging things."
"8","Have you ever seen someone experience an injury during a mace training session?"
"11","Close combat is where battles are won and lost."
"12","Shoot your bow like it's the last thing you'll ever do!"
"13","I'm willing to exchange some of my equipment for something that's more useful to me."
"12","Use your ranged abilities to harass and weaken your enemies!"
"4","How important is footwork in combat?"
"6","Begin with sword training visualization and meditation."
"8","Mace training, let's give it our all!"
"2","How do you see technology shaping the future of the world?"
"5","When does the quest become more difficult?"
"4","What are some effective battle strategies you recommend?"
"15","Check behind and under anything you come across."
"8","Let's practice with maces to become more proficient."
"15","Keep an eye out for items that can be used to make traps."
"3","No beating around the bush, give me a direct summary of our mission."
"12","Draw your bow and shoot it!"
"11","Let's close the distance and engage in close combat."
"1","What are your thoughts on time management for productivity? Can you tell me about a time when you were able to complete a large amount of work in a short amount of time?"
"8","Grab your training partner and let's practice with the mace."
"13","Can we make an equipment deal?"
"14","Let's see if you can hack the lock and get us in."
"11","It's time to get close and get it done."
"11","Close combat is where we excel."
"5","What kind of learning opportunities can I gain from completing this task?"
"7","Your axe training begins now - are you ready?"
"9","Let's go fist fight train and get in some cardio."
"4","How do I fight against cyberbullying and online harassment?"
"14","Put your hacking skills to the test and crack this lock."
"4","How do you recommend I use teamwork in a battle?"
"7","Time to get serious about axe training!"
"3","What is the primary aim of our current mission?"
"7","Don't hold back - give it your all with some axe training!"
"9","Would you be interested in practicing some fist fighting with me?"
"3","Let's revisit the core principles of the mission."
"7","Grab your axe and start training."
"9","Would you like to focus on both stand-up and ground fighting in our fist fighting training?"
"15","Begin your expedition to explore the new territory."
"4","How do you handle opponents who use dirty fighting techniques?"
"10","Relieve my pain."
"3","What are we working to achieve at present?"
"5","How do I ensure that I deliver a high-quality outcome while completing this task?"
"2","This world is a place of extremes, with deserts and rainforests, mountains and oceans, and everything in between."
"3","What is the current task that we're focusing on?"
"13","Let's negotiate an equipment exchange."
"10","Do I look like I'm struggling to stay awake?"
"9","How about we practice our evasive maneuvers and footwork?"
"8","Let's practice some mace combat moves together."
"4","How do I fight against food insecurity and malnutrition?"
"1","How did you navigate the challenges and obstacles on your journey?"
"13","Would you like to do a swap of possessions?"
"14","Use the battering ram on the door!"
"14","Use brute force to crack the lock."
"14","Let's see if you can hack this lock and get us in."
"3","What are the steps for completing our current task?"
"10","Restore my strength"
"9","Let's practice different combinations in fist fighting."
"7","How about axe training to channel your aggression into a productive activity?"
"4","What are some ways to use psychology to your advantage in a fight?"
"6","Sword training is waiting for us, let's go!"
"3","Can you remind me what our task is for today?"
"5","What kind of support can I get from my team to complete this task?"
"12","Ranged combat can be used to intimidate the enemy and lower their morale."
"1","Tell me about the goals and aspirations that have pushed you to grow and evolve."
"13","I have some items I'd like to barter with you."
"1","Tell me about the goals and aspirations that have shaped your journey."
"4","How can one effectively fight against discrimination in the workplace?"
"5","How do I ensure that the completion of the task aligns with the project goals?"
"13","I would like to take a look at your inventory."
"5","What are the necessary resources I need to complete this task?"
"10","I have a respiratory problem and need to find the right treatment."
"3","What is the expected impact of our current mission?"
"15","Scan the area for any possible hiding spots."
"6","Train on the sword with determination!"
"10","Time to heal me up."
"2","What are some popular activities to do in this place?"
"6","Ready to become a master swordsman? Start training."
"2","Can you describe a place in the world that you find particularly beautiful and why?"
"12","Pick off your enemies from a safe distance!"
"14","Apply a lock pick tension wrench to the lock of the chest."
"2","The world is full of opportunities for exploration and adventure, from the depths of the ocean to the reaches of space."
"10","Do you notice anything unusual about my breathing pattern?"
"6","Time to hone your sword skills, let's go!"
"14","It's up to you to break the lock with your hacking skills."
"8","Let's start mace training with some footwork drills."
"2","Tell me about the religions that exist in this world."
