"6","Let's not waste any more time, grab your sword and let's go!"
"12","Stay on the move and shoot from afar!"
"11","Use your opponent's momentum to throw them off balance and strike!"
"3","Stop beating around the bush and tell me the essence of our current mission."
"9","We should strive to become better at fist fighting."
"8","Mace combat is a fascinating and challenging martial art that I want to excel in."
"3","What is the priority task at the moment?"
"9","I want to build up my strength through fist fight sparring."
"10","Help me see hope again"
"8","I want to train until my mace strikes are lightning-fast."
"4","Can you offer advice on how to deal with unexpected enemy reinforcements during a battle?"
"15","Look around and see if there's anything that could be used."
"11","Close combat is intense and brutal."
"5","What do you think is the most effective approach to completing this task?"
"1","Can you tell me about a time when you had to handle a difficult situation with a subordinate who was not meeting performance expectations?"
"14","Use your skills to hack the lock quickly and quietly."
"6","Start your sword training and unleash your potential."
"5","How can I restore my health during this quest?"
"8","Let's start our mace training with some shadowboxing."
"13","Let's exchange resources for mutual benefit."
"10","Should I seek medical attention for my low health?"
"9","Would you like to have a friendly competition to see who's better at fist fighting?"
"10","Do you think I look pale?"
"12","Start using your ranged abilities to control the battlefield."
"5","What kind of feedback can I expect while completing this task?"
"3","What is the purpose of our current task?"
"1","Share your story of learning to trust your intuition and inner voice."
"12","Use your environment to your advantage and fight in ranged combat."
"15","Search the area systematically and cover every inch."
"9","Do you want to try some combination moves during our fist sparring practice?"
"5","How do I communicate the completion of the task effectively?"
"2","Can you tell me about the different forms of art and entertainment that exist in this world?"
"12","Take down your opponent with your bow!"
"10","Can I rest to recover my health? I have little left."
"13","Display your inventory for me, please."
"7","Get started on your axe training with eagerness."
"14","Break through the door with a heavy-duty vehicle!"
"2","Can you tell me about a time when you felt a sense of wonder towards the world?"
"8","Do you think mace training can give us an edge in battle?"
"1","What led you to develop a sense of gratitude and appreciation for life?"
"10","Heal me like you mean it!"
"7","Let's start axe training!"
"3","What is the task that needs to be completed right now?"
"9","I want to test my limits with some fist fight sparring."
"15","Explore the nearby woods and trails."
"2","Can you tell me about a moment when you felt a deep sense of love for the world?"
"5","How can I use my strengths to complete this task effectively?"
"1","Can you tell me about your hobbies and extracurricular activities?"
"13","How about we trade resources?"
"8","I'm dedicated to becoming a mace expert."
"4","Can you suggest some tactics for dealing with an opponent's body armor?"
"1","I'm interested in learning more about your decision-making skills. Can you tell me about a time when you had to make a tough decision with limited information?"
"5","How do I overcome any obstacles that may arise while completing this task?"
"6","Let's start with sword training mastery and expertise."
"6","Get your sword and start your training routine."
"15","Investigate the area to see if there's anything worth taking."
"3","What is the goal we're working towards?"
"3","What is the purpose of our current mission?"
"9","We can work on our technique during some fist fight sparring."
"10","Can I use your first aid kit since I have an emergency?"
"6","Let's start with sword training strategy and tactics."
"7","Let's practice with axes until we can't get it wrong."
"10","What are the consequences of having low health? I have little left."
"6","Let's get to the training area and start sword practice!"
"15","Keep your eyes peeled for anything of value."
"10","Can you assist me in finding a first aid kit?"
"3","We can't afford to lose sight of our mission. Tell me the essence of it, now."
"3","What opportunities does our current task present for our organization?"
"15","Start by searching the perimeter of the area and work your way inward."
"14","Don't hesitate, apply your hacking skills and crack this lock."
"13","Let's see if there's anything we can trade."
"7","Let's train for the upcoming axe tournament with some intense practice."
"9","Get ready to dodge and weave during our fist fight sparring session."
"4","What are some tactics for maintaining focus during combat?"
"5","What kind of analysis or research do I need to do to complete this task effectively?"
"7","How can practicing with an axe improve your problem-solving skills?"
"3","What is the current objective we are working towards?"
"6","Do you want to master the sword through practice?"
"6","Would you like to learn some powerful sword techniques?"
"15","Consider bringing in a K-9 unit to help search the area."
"2","What do you think is the most beautiful cultural monument in the world?"
"15","Take time to reflect on your experiences."
"15","Make a map of the area as you survey it."
"5","Can you recommend any shortcuts to help me complete this task faster?"
"8","What are some advanced mace training techniques?"
"9","How about we organize a fist sparring competition with cash prizes?"
"11","Keep your opponent guessing with a variety of attacks!"
"9","Focus on your breathing and maintain a relaxed but alert state of mind."
"7","What kind of wooden targets should you use when practicing with an axe?"
"9","Do you think we could work on our fighting strategy with some fist sparring?"
"13","I'm looking to do a trade."
"7","Do you want to learn how to wield an axe?"
"4","What are some good conditioning exercises for fighting?"
"4","How do you think I need to fight for animal rights?"
"2","What are some of the most fascinating discoveries and breakthroughs that have been made in this world?"
"15","Survey the area in a counterclockwise direction."
"1","Share your story of finding balance and harmony in your life."
"8","Don't waste any more time, let's train with the mace."
"8","Let's work on our mace techniques to become better fighters."
"2","How has the media's portrayal of the world impacted our perception of it?"
"15","Make sure to search any nearby caves or crevices."
"11","It's time to start fighting in close quarters."
"3","We are on a mission to promote mental health and well-being."
"3","What is the mission we are currently working on?"
"14","With your hacking skills, that lock doesn't stand a chance."
"15","Let's take a walk around the block."
"11","Keep the pressure on with continuous attacks!"
"8","Grab your training mace, we're training!"
"4","Should I focus on speed or power during the fight?"
"1","Describe the moments that have tested your resilience and adaptability."
"7","Start your axe training with a winning mentality."
"8","How does mace training compare to other functional fitness exercises?"
"1","Describe the moments that have taught you the value of self-awareness and self-reflection."
"1","Can you describe your approach to performance improvement? Tell me about a time when you identified an area for improvement and took steps to improve your performance"
"3","I need a quick reminder of our current task."
"12","Use your ranged weapons to keep the enemy on their toes!"
"10","Bring me the cure"
"3","What are the priorities of our current mission?"
"2","Can you describe a work of art that captures the essence of the natural world?"
"10","I need to find a treatment center for my addiction."
"7","Axe training is the key to becoming a skilled warrior!"
"6","How can we improve our hand eye coordination during sword fighting?"
"10","Would a health potion be useful in a long-term quest?"
"15","Let's take a hike and see what's around."
"3","What is the reason behind our current mission?"
"4","What are some tips for winning a fight?"
"1","I'm interested in learning more about you. Can you tell me about your achievements?"
"11","Use your body weight to deliver a powerful blow!"
"10","I need to be healed."
"2","The world is a treasure trove of knowledge and wisdom."
"7","Let's work on your axe swinging technique!"
"3","What is our current role and responsibility in the project?"
"10","Can you please use your healing touch?"
"12","Commence long-range attacks with your spells."
"3","I'm a bit fuzzy on our current task. Can you remind me?"
"5","What research do I need to do before starting this task?"
"2","What is the fashion or clothing style like in this place?"
"6","Sword training will make us more formidable opponents."
"15","We can't say we've truly experienced the area until we explore the nearby place."
"5","How do I balance creativity with practicality in completing this task?"
"12","Hit your target with your bow!"
"13","I'm interested in exchanging things with you."
"12","Pick up your crossbow and fight in ranged combat."
"1","Can you describe your approach to mentoring? Tell me about a time when you mentored a team member and helped them grow professionally."
"8","I want to start mace training."
"12","Get ready to shoot your bow!"
"1","What are your future career aspirations? Tell me about yourself."
"7","Begin your axe balance training."
"15","See if there are any valuable resources nearby."
"2","Tell me everything you know about this place."
"7","Begin your axe training and stay focused."
"15","Look for any natural materials that could be used to construct a raft or boat."
"11","Don't give your opponent any breathing room, keep attacking!"
"13","Let's exchange equipment."
"10","Do you have any idea why I'm sweating so much?"
"15","Look around and see if there's anything that could be useful."
"7","It's time to perfect our axe handling."
"1","What are your thoughts on delegation? Can you tell me about a time when you successfully delegated tasks to others and how you ensured they were completed successfully?"
"2","How does this world deal with issues related to conflict and war?"
"9","Hone your fist fighting skills with training!"
"9","Let's work on improving our fist fight game."
"9","Can we train together for a fist sparring championship?"
"1","Tell me about the goals and aspirations that have helped you grow and evolve."
"12","Shoot them down with your ranged weapons!"
"7","Let's get into some serious axe training!"
"5","What are the rewards for completing this quest?"
"4","Do you have any advice on battle tactics specific to this enemy?"
"2","Can you tell me about the different types of conflicts that have occurred in this world?"
"7","Let's get to work on your axe training."
"13","How about sharing resources and making the most of our strengths?"
"10","How long does it take for a health potion to take effect?"
"10","Do you carry a first aid kit on your person at all times?"
"7","How about some axe training?"
"4","How do you think I need to fight for my spirituality?"
"7","Let's spar with axes to improve our skills."
"2","How does this world connect people from different parts of the globe?"
"13","I want to explore the possibility of exchanging resources."
"3","What is the current end goal of our mission?"
"8","Let's begin our mace training session."
"8","Let's work on mace parrying and blocking techniques."
"2","Can you tell me about a time when you felt a sense of responsibility towards the world's coral reefs?"
"4","What are your strategies for fighting against poverty?"
"4","What do you suggest for fighting against social injustice?"
"15","Don't miss anything as you search the area."
"3","Can you remind me what we're supposed to be doing right now?"
"1","Share your story of taking risks and stepping outside of your comfort zone."
"2","This world is home to countless traditions, beliefs, and philosophies, each with their own unique perspectives on life."
"1","Can you share with me your approach to networking and building professional relationships, and how it has impacted your career success?"
"6","Are you up for some sword practice today?"
"4","How do you think I need to fight against fake news?"
"9","How about we practice some weapon disarms and defenses?"
"1","Can you tell me about a time when you had to work with a team to overcome a communication barrier or language barrier?"
"2","How do you think different religions and beliefs impact the way we see the world?"
"4","How do you stay safe in a physical confrontation?"
"6","Do you think sword training is a good idea for us?"
"8","Get ready to practice with the mace, let's go!"
"2","This world is full of diverse cultures, traditions, and ways of life."
"9","Would you like to improve your punching technique with me?"
"2","The world is a place of both growth and decay."
"15","Scavenge for anything that can be used to start a fire."
"3","Can you explain the rationale behind our current task?"
"4","How do you recommend I defend myself against ranged attacks?"
"11","Our weapons won't help us much in this situation, we need to engage in close combat."
"13","Let's exchange resources that we have too many of."
"10","Heal my soul."
"13","Can we exchange some goods?"
"5","How can I minimize the stress and pressure of completing this task?"
"3","Can you explain the interdependencies between our current task and other projects?"
"8","I want to learn how to wield a mace with precision."
"7","Let's work on our axe speed and accuracy."
"8","Mace training will give me an edge in battle."
"8","Let's train with the mace and build some endurance."
"10","Please, heal me so I can keep fighting."
"10","Mend my broken heart"
"13","Can we exchange some of our belongings?"
"2","This world is a river of life, flowing through time and space."
"6","Start your sword practice!"
"15","Hunt for anything that could aid us in our journey."
"6","Start your sword training for success!"
"5","What communication channels should I use to keep stakeholders updated about the completion of this task?"
"13","Do you have any resources you'd like to get rid of?"
"13","Would you like to do a barter?"
"3","What is our reason for pursuing our current mission?"
"9","Let's go fist fight train and improve our agility."
"13","Would you be interested in a resource exchange?"
"1","Can you tell me about a time when you had to handle a difficult situation with a vendor or supplier who was not meeting expectations?"
"11","Let's start close combat and end this quickly."
"5","Are there any tips for completing this quest?"
"1","Describe the experiences that have taught you the importance of perseverance and determination."
"6","Let's not wait any longer, go get your sword and let's start training."
"6","Your sword training program starts now."
"4","Can you suggest some tactics for defending against an ambush?"
"3","What is the current aim of our mission?"
"2","Can you tell me about any famous landmarks or natural wonders in this place?"
"8","Let's perfect our mace forms."
"8","Join me for some mace sparring."
"7","Begin your axe training now!"
"1","Can you discuss your views on the importance of authenticity and transparency in the workplace, and how you demonstrate those values in your interactions with others?"
"7","How can practicing with an axe improve your resilience?"
"9","I want to become more disciplined through fist fight sparring."
"5","How do I strategize for each stage of this quest?"
"1","What led you to pursue a life of authenticity and self-discovery?"
"2","What's the demographic makeup of this place?"
"7","Get ready for your axe training!"
"7","Let's have a mock axe fight to test our skills."
"13","Could you show me your inventory list?"
"5","What are the consequences of not completing this task on time?"
"8","Have you noticed any improvements in your core strength since taking up mace training?"
"15","Let's see what's on the other side of the river."
"13","Let's swap some equipment that's not being used to our mutual benefit."
"6","Would you like to try different sword grips?"
"2","What are some of the most important medical breakthroughs that have been made in this world?"
"10","Is there something wrong with my eyesight?"
"12","Use your ranged weapons to hit your enemies where it hurts!"
"9","We need to work on our ability to stay calm under pressure in fist fighting."
"10","Are there any negative side effects of using health restoration items?"
"14","Can you pick the lock on this briefcase?"
"10","Do you know where I can find a health potion?"
"10","Heal my mind and body."
"14","Try to force the lock on the chest with a torque wrench."
"8","Let's hone our mace skills with dedicated practice."
"15","Focus your search on areas that are more sheltered from the elements."
"7","Train with me and become the ultimate axe warrior!"
"2","Can you describe a sculpture that captures the essence of the world?"
"9","It's time to fine-tune our fist fight form."
"13","Can we exchange items of equal value?"
"13","Want to do a resource swap?"
"4","How do you suggest I improve my battle tactics?"
"9","Let's practice fist fight sparring."
"7","Start your axe training and stay motivated."
"5","What are the potential challenges I may face in completing this task?"
"5","How can I successfully finish this quest?"
"15","Map out the territory."
"2","The world is a place of constant change and adaptation."
"15","Don't rush your search, take your time and be thorough."
"3","The clock is ticking, remind me of our mission's fundamental purpose."
"8","How can mace training benefit individuals who play sports or engage in physical activities regularly?"
"15","Look up, down and all around."
"10","I require some chiropractic adjustment."
"2","This world is a place of contrasts, with both beauty and darkness coexisting side by side."
"2","What is the literature scene like in this place?"
"12","Stand your ground and fight in ranged combat."
"5","How can I celebrate once I have successfully completed this task?"
"8","Have you ever trained with a mace before?"
"4","What are the most important qualities to have as a fighter?"
"3","No time to waste, get to the heart of our mission."
"13","I'd like to swap items with you."
"2","Can you tell me about a moment when you felt a deep sense of wonder at the mysteries of the universe?"
"8","Grab your gear, and let's go practice with maces."
"12","I am familiar with different types of bows."
"2","Can you tell me about a moment when you felt a deep sense of peace in"
"10","Stop my bleeding."
"4","Can you share your fighting tactics with me?"
"3","What is the current aim of our project?"
"14","We need a hacker to get us through this lock, can you do it?"
"6","Should we practice sword fighting using different stances?"
"12","Shoot from a distance with your bow!"
"4","What are some common mistakes to avoid during a fight?"
"15","Set out on a journey of exploration across the territory."
"9","Experiment with different footwork patterns to keep your opponent off-balance."
"11","Use your footwork to move in and out of range and strike!"
"13","I have some items I'd like to swap with you."
"4","How can one effectively fight against corruption?"
"2","The world is a place of both growth and stagnation."
"15","Take a look around and survey the area."
"5","How can I evade the traps in this quest?"
"12","Ranged combat can allow us to take out the enemy's leadership from a distance."
"5","How do I interact with NPCs to help me complete this quest?"
"13","What's in your inventory right now?"
"11","If we want to win, we have to start close combat."
"7","Want to improve your axe skills?"
"13","Let's exchange resources to help each other."
"12","We can use ranged combat to draw enemies out of cover."
"6","Are you interested in learning the art of sword fighting?"
"8","Are you interested in learning how to use a mace?"
"9","Let's work on improving our footwork in fist fighting."
"2","What can you tell me about the history of this place?"
"10","Do you know of any shops that sell health potions?"
"10","Is there a way to restore my health? I have very little left."
"5","Can you suggest some tools or equipment that will help me complete this task?"
"1","What are your thoughts on the role of empathy and emotional intelligence in effective leadership, and how do you cultivate those qualities in yourself and others?"
"9","Let's focus on our mental preparation for fist fighting."
"15","Look out for anything that could aid us in our quest."
"9","Use a foam roller or massage ball to relieve muscle soreness and tension."
"3","What is our ultimate objective with the current mission?"
"6","Take your sword and begin your training journey."
"15","Gather information about the area."
"15","Don't overlook the small details."
"15","Let's get lost in the beauty of the nearby area and explore."
"2","In your opinion, what makes this world unique?"
"12","Ranged combat can help us avoid unnecessary casualties."
"8","Let's work on our mace techniques together."
"4","Do you think I need to improve my ability to take hits in a fight?"
"9","How about we practice some defensive moves and counter-attacks?"
"14","Ram the door with your shoulder!"
"7","Start your axe training with a positive attitude."
"12","Shooting a bow has improved my hand-eye coordination."
"6","Let's practice sword fighting and improve our technique."
"6","Begin with sword training defensive techniques."
"12","Shooting a bow has taught me patience."
"11","Use your opponent's reactions to set up your next attack!"
"8","Let's start our training session with some mace practice."
"8","Have you noticed any improvements in your flexibility since incorporating mace training into your routine?"
"4","Do you recommend cross-training in other sports or activities to improve my fighting abilities?"
"2","What are the historical landmarks of this place?"
"1","What led you to pursue a career that aligns with your values and passions?"
"1","What are your strengths and weaknesses? Tell me about yourself."
"3","What is the purpose of our current project?"
"13","Let's exchange resources to optimize our efficiency."
"12","Remember your training and fight in ranged combat."
"13","What do you have in your inventory to show me?"
"5","How do I ensure that I'm meeting all the requirements of this task?"
"14","Apply your hacking abilities to get us inside."
"8","We could use some mace practice, let's go!"
"15","Take a team and divide the area up to search more efficiently."
"1","What are your thoughts on organizational culture? Can you tell me about a time when you helped to create a positive organizational culture?"
"8","Join me for some intense mace training."
"2","The world is a place of endless possibilities."
"10","I require some aromatherapy."
"4","Can you offer some strategic advice for battle?"
"12","Shoot like you mean it!"
"3","What are we working towards right now?"
"3","What is the purpose of the current project?"
"6","Let's train on sword techniques to become elite fighters."
"1","I'm interested in learning more about your negotiation skills. Can you tell me about a time when you successfully negotiated a difficult agreement or resolution?"
"8","I want to perfect my mace timing."
"9","Shall we work on our elbow and knee strikes in close combat?"
"6","Practice your sword techniques with dedication."
"10","Can you spare a first aid kit for me?"
"13","Can we exchange resources to solve both our problems?"
"12","Ranged combat is ideal for attacking enemies that are difficult to approach."
"4","Can you provide any successful examples of using diversion tactics during a battle?"
"13","Let's trade resources for something we need."
"11","Strike with all your strength and speed!"
"14","Can you pick a lock with a shimmy?"
"12","Begin picking off enemies one by one from a distance."
"8","Would you like to try some mace drills with me?"
"13","I'm interested in exchanging resources with you."
"15","Search the area in a zig-zag pattern to cover as much ground as possible."
"10","My stomach is upset"
"2","This world is a place of both tragedy and triumph, where we struggle against adversity and overcome it through perseverance and courage."
"3","The clock is ticking, remind me of the crucial objective."
"13","Let's discuss exchanging some of our equipment."
"8","Grab your gear, we're practicing with the mace today."
"7","Would you like to see some impressive axe demonstrations?"
"9","Focus on proper nutrition to fuel your training and aid in recovery."
"9","Do you want to have a fist sparring session with me?"
"8","How heavy should your mace be for effective practice?"
"6","How about finding a sword training partner?"
"8","It's mace training time, let's do this!"
"1","Tell me about a time when you had to manage competing priorities or conflicting demands in your work, and how you navigated that situation."
"11","This is not the time for long-range combat, engage in close combat instead."
"8","What is the difference between a steel mace and a wooden mace?"
"6","Let's become elite swordsmen through training."
"10","My head is throbbing with pain"
"2","Tell me about the role of sports and entertainment in this world."
"3","What task should we be focusing on right now?"
"2","Tell me about the different ecosystems that exist in this world."
"1","Can you discuss your views on the importance of continuous learning and professional development, and how you stay current with industry trends and best practices?"
"8","Let's improve our mace combat skills. Let's practice together."
"1","Can you discuss your views on the importance of continuous innovation and improvement in the workplace, and how you foster a culture of experimentation and learning?"
"6","Practice sword techniques to perfection."
